Date,UserName,Comment,Like
2025-10-15T17:30:32Z,@abdulmushabnakbaubau8500,suratin cup u13 u15 sampe u17 ingat baru aja laksana,0
2025-10-15T17:29:46Z,@fitrisyafmiramadhanty226,gregetan gw denger si justin,0
2025-10-15T17:29:03Z,@ArifMuhamad21,janggan sd fer sd gak tonton ntar lulus sma jadi pns bukan main bola,0
2025-10-15T17:28:02Z,@reeyancard,si paling gk salah kalau salah gk ban,0
2025-10-15T17:27:48Z,@ArifMuhamad21,feri mau bikin liga kampus gawat pssi mulai senggol,0
2025-10-15T17:26:36Z,@icannotmyidea,dear koci latih inggris skrg tuchel bukan orang inggris orang jerman,0
2025-10-15T17:26:23Z,@AndrewJosh-c5w,bang ferry jadi tum pssi beliau cinta sepakbola energi baru buat sepakbola indonesia depan,0
2025-10-15T17:26:03Z,@gugumfadilah7087,indonesia bineka tunggal ika indonesia agam sepak bola tim milik lebih filosofi filosofi campur,0
2025-10-15T17:24:20Z,@reskiecot,realistis vs idealis beda sudut pandang masing2 punya good poin satu tuju indonesia raya kumandang wc,0
2025-10-15T17:24:02Z,@baacot436,yaa jalan contoh sty gara gara lu recokin aja,0
2025-10-15T17:23:28Z,@ZakiyalFuad,dah laaa cochi ni cuci tangan dg bacot aja libat dg komentar depak sty jilatin pilih pk dkk cuiiihh,0
2025-10-15T17:23:02Z,@nimoanggie7203,ngomong ngomong filosofi filanesia apa,0
2025-10-15T17:22:53Z,@andikaadiprasetyo7841,misal ni yg nanya milih kasi duit milyar ato timnas indo lolos piala dunia milih realistis nerima duit milyar dulu wakakakak,0
2025-10-15T17:21:51Z,@AnangMaruf-vq7sl,indo udh lekat sty 4tahun hampir 5tahun liat progres jaman gelap sampe hampir sinar terang terus sekarang gelap udh bukti kok masalah main tahan main serang mau yg penting progres lanjut nol sama sty pilih yg aja pilih yg gak gambling percaya latih yg progres,1
2025-10-15T17:21:46Z,@AGUSB721,botak cuci tangan,0
2025-10-15T17:21:28Z,@hiatusproject1826,italy main mana eropa latih apa eropa indonesia mai mana asia peatihnya apa eropa nah lu gak ngeles butuh pelth yg bukan cuman paham main paham sama lawan patrick jangan paham lawan paham peran mai sendiri aja gak padahal sama sama ngomong belanda,1
2025-10-15T17:21:17Z,@abdulmushabnakbaubau8500,dengar2 koci ngikut aja otak sama siapa lawan ngobrolnya hehe ga konsistennjuga kayak,0
2025-10-15T17:20:34Z,@mieacehkotasigli1508,,0
2025-10-15T17:20:16Z,@goodthingszyz,begadang,0
2025-10-15T17:20:00Z,@EkoSupriyanto-ow2zo,sangon pk 40m 100jt orang gemar timnas 400perak orang lengkap orang patungan buat sekali bayar latih baru sederhana kan simple gerak yookkk,0
2025-10-15T17:19:17Z,@kurororyodan,yaah fc kirain e football,0
2025-10-15T17:19:02Z,@tedilesmana8641,banyak channel podcast bahas bola gaada mau nyatuin ferry sama towel,0
2025-10-15T17:18:50Z,@rezadn4057,koci mau cuci tangan,0
2025-10-15T17:18:14Z,@sugisugi947,bukan dikit dikit pecat kalah buanyak pecat,0
2025-10-15T17:16:55Z,@humanis7684,sangat harap erik tohir tinggal pssi anjing2 sty tau apa sepakbola wakanda yg benar,0
2025-10-15T17:16:30Z,@bakasrizky3507,semangat koci bg ferry lurus mindset orang quot indonesia timnas indonesia,1
2025-10-15T17:15:31Z,@naumy7658,siapp 50ribu subscribe potong video koci dukung sty auto viral,1
2025-10-15T17:15:01Z,@gusmansitorus5733,batcot,0
2025-10-15T17:14:20Z,@Ax7-i7r,main belanda belanda pindah spanyol korsel or jepang,0
2025-10-15T17:12:55Z,@chuloprojectsquadremix,si botak sakit gak nyambung nampak kali bela si trik,0
2025-10-15T17:12:14Z,@nizarernanda4398,jangan kasih panggung orang yng hancurin timnas,0
2025-10-15T17:12:00Z,@Ax7-i7r,cuci cuci cuci wkwk,0
2025-10-15T17:11:49Z,@muhammadluthfierdipriatna72,cuci tangan terus si taiii,0
2025-10-15T17:11:09Z,@baacot436,waktu sty bgitu lu kebelet belanda,0
2025-10-15T17:11:00Z,@kurororyodan,yg pas sih liga juara nasional kayak jepang sd sma situ kan pantau yg bagus bagus main mana aja dini,0
2025-10-15T17:09:19Z,@bayurocky1326,patrick emang gak niat maju timnas indonesia kalah irak langsung kabur belanda gak pamit suporter indonesia si patrick mental tukang judi lihat jelas tipikal org yg gak mau bertanggungjawab lebih baik gak usah kerjasama dgn latih kompeni belanda,0
2025-10-15T17:09:18Z,@AlviAlvi-go5vo,si botak kultur belanda mulu gak ngerti kultur sepak bola indonesia ngomong ngaco gak jelas gak tenang gemetar kepala batu kek nahan emosi counter ferry,0
2025-10-15T17:09:17Z,@wisnu7724,gak gitu bang fer jepang ekosistem emang udah jalan emang bina mulai sekolah fasilitas baik oke kayak kata lu kompetisi jepang jalan level dasar nasional prefektur indonesia punya bang o2sn olimpiade olahraga siswa nasional level sekolah sd sma kabupaten nasional fls2n festival lomba seni sastra siswa nasional sama jenjang praktek gak unsur bina gak fasilitas baik sekolah indonesia tau sendiri gimana fasilitas praktek gak unsur bina kalau indonesia cuma buat neng lihat paling lama siap siswa buat o2sn sama fls2n paling lama cuma beberapa bulan doang beda jepang mana wadah ekstrakurikuler unsur bina sedang indonesia asal aja,0
2025-10-15T17:08:10Z,@khanipmuslih3448,wow tarik sekali kata kunci quot gue buget nol aja bikin liga junior quot,3
2025-10-15T23:19:13Z,@rpmahardika6650,turut alas utama rasa jasa terus jadi manusia susah kasih tahu,0
2025-10-16T00:58:55Z,@M.IrsyaadilhamSS.1302,rpmahardika6650at least ngga ngomong doang proyek kks yg jalan,0
2025-10-16T01:03:50Z,@syahrulaldiansyah261,fakta bang buget aja bikin liga pssi bikin liga kek kochi,0
2025-10-16T01:06:37Z,@putriandini9799,rpmahardika6650dia bukti punya alam pssi apa kabar,0
2025-10-16T01:29:52Z,@rpmahardika6650,arti kalian percaya keti rasa jasa koci terus sombong mana mana lupa liga jalan peran teman teman lupa sejak awal plin plan bilang gratis e g bayar wasit buat liga bayar benar benar plin plan sulit jadi patok kan kalau aku iri ngapain dulu lihat pahlawan sekarang hina nasional,0
2025-10-15T17:07:43Z,@fajarmuhammadrahman9103,mana orang belanda pride nya tinggi orang belanda tuh logis arrogant mata duit mana mungkin mundur udah merdeka jajah belanda,0
2025-10-15T17:07:25Z,@OmAkim-y1v,jerman boss,0
2025-10-15T17:07:10Z,@CARLOSTHOMAS2651,auo orang pssi tum jajar nonton video endengarnya,0
2025-10-15T17:06:42Z,@bosnost8158,mas bagus jaman sty indra sapri banyak tunas tunas muda main timnas timnas bukan skuad belanda diaspora belanda maksimal main tiap laga kemarin balik bukan menang malah los dol,0
2025-10-15T17:06:36Z,@claytondarrien,get real ferry irwandi lokal otak gak punya visi jgk panjang yah u postur kecil2,0
2025-10-15T17:06:04Z,@mzeinr,jejak,0
2025-10-15T17:05:55Z,@kibay234,kesini ga nonton cuma mau nulis orang2 gak ngerti bola ngebacot,0
2025-10-15T17:05:50Z,@chuloprojectsquadremix,udah bang si botak muka,0
2025-10-15T17:05:05Z,@bagusmuharam164,cari latih kayak cari latih ssb kocak kocak,0
2025-10-15T17:04:26Z,@darmantomanto2194,tohot bukan korban elektabilitss krn sbg tum mrdtinys pumya visi misi n progrsm tinggal memenegnya managerialnya jd menpora yg dulu dg tdk jd tum pssi gagal jd tri bumn diam2 anak buah pd korupsi sm sj gagal patut duga libat,0
2025-10-15T17:03:55Z,@danusulastio3034,mencla mencle,0
2025-10-15T17:02:27Z,@TiyokKuswoyo,sty pegang senior u23 u20 masuk piala asia lewat kualifikasi yg latih dulu susah banget lolos,0
2025-10-15T17:01:58Z,@Bayhilsap,gua saranin koci jangan ngomongin timnas lah banyak sen,0
2025-10-15T17:01:40Z,@yogiekurniawan6151,cari dulu kental bnget logat sumbar uda ferry,3
2025-10-15T17:01:19Z,@lefles-ofc,gin gap budaya sepak bola n filosofi org asia eropa terlalu jauh beda sukses dg latih bagus eropa perlu makin banyak jg main naturalisasi bagus standar eropa arah maju sepak bola banyak main asli negeri kiblat korsel jepang gap budaya sepak bola jg msh lebih realistis kejar hasil cipta tim yg gk gantung diaspora butuh waktu opsi paling realistis maju sepak bola indonesia level junior senior makanya aneh kalo pssi dg projek jangka panjang nya pilih latih timnas eropa arti level junior senior isi bule baik federasi lebih realistis pilih arah kembang sepak bola negeri,2
2025-10-15T17:00:02Z,@ariqalfarizi7575,seru bgt episode,1
2025-10-15T16:59:59Z,@Bayhilsap,aneh koci ga jelas statement nya kocak lu,0
2025-10-15T16:59:54Z,@limbunhuat4612,iyaa banyak tempat doi cuci tangan mulut,0
2025-10-15T16:58:43Z,@chuloprojectsquadremix,koci muka,0
2025-10-15T16:58:40Z,@adentokirana230,gw pribadi harap skuad timnas indonesia kualifikasi piala dunia kemarin main semua aff utk coba skuad level asean sisi jadi piala hibur lolos indonesia piala dunia momentum lanjut siapa tau bsa juara aff utk pertama kali dg skuad,1
2025-10-15T16:58:03Z,@MohZainuddin-y7x,yg tengah ngomong nya ngaco kayak koci gak masuk nalar,0
2025-10-15T16:57:57Z,@bima_d.a,sumpah gw dukung banget kalian kl buat liga tingkat sekolah,1
2025-10-15T16:56:35Z,@doank9681,waktu jadi urus bem universitas muslim indonesia makassar tahun jadi ketua panitia pernah adakan liga kampus animo besar sekali semua kampus partisipasi layak modal juta kok,1
2025-10-16T03:09:55Z,@rizmeg3190,udah ga mas modal segitu m inflasi gila gila quot perijinan quot tragedi kanjuruhan makin sulit mahal,0
2025-10-15T16:56:31Z,@Vistavruval,inti et busuk aja ngambil ganti sty alias buru,0
2025-10-15T16:56:18Z,@kaoskaosdistro,siapa ganti jangan latih lokal superleague aja gk percaya,0
2025-10-15T16:55:43Z,@MohZainuddin-y7x,inti siapa entah latih tum pssi yg mampu menang hati suporter sang menang aja kok repot,0
2025-10-15T16:55:33Z,@HRNET-r6b,gegara orang tnpa rmbut tim nas gk bs masuk pildun,0
2025-10-15T16:55:26Z,@PantasticSahaja,botak kalau lho jago jadi latih apa gak punya hati nurani jadi latih indonesia apa mau jadi sa penghianat bangsa bila benar,0
2025-10-15T16:55:11Z,@danielyesayas3880,ganti sty tengah jalan g asampai piala dunia dulu kalau bicara tanam filosofi sty sdh laku,0
2025-10-15T16:55:08Z,@triwantoirfan9809,tahan kluivert kluivert titipin main kan lumayan tuh duit buat depo si kluivert lah wong si kluivert kang jud1 kok,0
2025-10-15T16:54:10Z,@sadmareviardi1750,diskusi akhir jelas arah,2
2025-10-15T19:22:47Z,@YokiPrasetya,lu yg gak jelas,0
2025-10-15T16:54:01Z,@yustinusmecewijoyo4875,lebih tuju apabila alex pastor angkat jadi latih kepala ganti pk,1
2025-10-15T16:53:29Z,@FianKilimanjaro,koci elu kayak lebih cocok jadi standup komedi,0
2025-10-15T16:53:15Z,@aguswirawan__,yg gemuk tengah ga usah ajaak ga debat,0
2025-10-15T16:53:08Z,@Gnkid,turut data trs yg tengah,0
2025-10-15T16:52:52Z,@asyauqiabadi1617,jadi mau bilang indonesia belanda,0
2025-10-15T16:52:22Z,@mbakpbaru,pk dancuk,0
2025-10-15T16:52:04Z,@betams-x4k,ingat pssi dijadilan alat politik moles citra,0
2025-10-15T16:51:58Z,@arifebrianto6085,overdomeh koe londo wuhan tua bangke,0
2025-10-15T16:51:47Z,@calvin-gp3gp,negara tata konsistensi level akar rumput jelas paten bicara filosofi big bullshit on the world men,0
2025-10-15T16:51:18Z,@ArifMuhamad21,tuju pssi kalau gak mau benerin bina usia dini bubar,0
2025-10-15T16:51:01Z,@heyw3591,orang paling tanggung jawab kalah timnas indonesia erick thohir punya hak mecat milih latih kan tum pssi,0
2025-10-15T16:50:48Z,@pedesign5686,kekacaun bikin trauma generasi ragu2 jd main bola main bola sih tetep suka singgung sam orang2 tuh males kalau gw muless,0
2025-10-15T16:50:13Z,@ebypuja,gw tuju coach justin influencer bukan latih beri beesuara gw putus dengar coach justin,10
2025-10-16T01:17:21Z,@andipamungkas3397,wkwkkw,1
2025-10-16T02:40:53Z,@davidyodo24,hahahaha,0
2025-10-16T03:13:32Z,@DendiAdrian-i8x,inti netizen indonesia kalau timnas hasil puja puja kayak dewa kalau gagal hujat mampus timnas gagal mulu,0
2025-10-16T03:31:37Z,@Xvanz13,dendiadrian i8xwelcome to indonesia bro kalau lu gagal achivment minat banyak contoh sepak bola udah bakal kena hujat netizen nyari kambing hitam buat salah contoh kasus sekarang netizen indo sampek nyerang instagram anak si pk akhir anak si pk sampe mati komen instagramnya,1
2025-10-16T03:56:00Z,@DendiAdrian-i8x,xvanz13itulah timnas gak bakal maju laku netizen nya aja kayak gitu,0
2025-10-15T16:49:26Z,@rickyhermwan6272,wkwkwkw bulan dapet goal open play yg kata tim latih baik panjang masa,0
2025-10-15T16:49:11Z,@RyanHwa,pssi klo isi orang2 sepak bola maju bahkan saing level dunia sygnya pssi isi orang2 yg mayoritas ga paham sepak bola cuma jadi kendara politik semata,1
2025-10-15T16:48:52Z,@apeltiga6887,ga cocok total football buat indo paling cocok gaya maen sty mourino fokus tahan peluang kick n rush tik taka,0
2025-10-15T16:48:15Z,@rainfire1974,latih goblok sejarah,0
2025-10-15T16:48:13Z,@adentokirana230,netizen indonesia terlalu jumawa ga sadar indo tim debut kelas italia juara piala duni kali aja kali turut ga lolos pildun jepng sendiri lalu banyak sulit utk tahap,0
2025-10-15T16:48:02Z,@abu.abdirrohman,mana mau latih top latih timnas soal ngeri sama mental netizen pundit buzzernya indo,0
2025-10-15T16:47:10Z,@mochamadrizalrastra383,podcast aja yg kochi skak terus ngikut sisa berkuasaa,0
2025-10-15T16:46:23Z,@naufalakbar-l5n,gw bukan orang bola paham tuju koci buat apa liga mahasiswa ga bakal hasil buat timnas kalo mau contoh sukses liat aja badminton ga usah naninu bikin gairah buat mahasiswa bawah bagus bukan poin kalo punya temen rumah atlit bola paham sd gembleng smp sma banyak udah ga indo banyak luar negri lanjutin kalo benerin bina sd pr ga terlalu banyak kirim luar negri sembari benah kelompok umur atas,0
2025-10-15T16:46:02Z,@hector11235,kalian tahu gak klo pt garuda sepakbola indonesia gsi rups agustus umum raih untung milyar lo googling aja udah banyak berita kalian cuma gak aware aja yg ngurus kontrak kluivert cs jadi klo cuma pecat gerbong nya kluivert yg kata milyar buat bas orang sih gw rasa cukup kali pssi sekarang punya cukup uang,0
2025-10-15T17:06:00Z,@hector11235,konsep student athlete student comes first yg arti standart nilai baru athlete nya alias sport kayak film coach carter,0
2025-10-15T16:45:59Z,@adriellkusumapuani-ut3eo,coach bukan latih mantan latih gak pas panggil coach cukup nama sopan,0
2025-10-15T16:45:24Z,@DikiDuwisaputro,ferry sangat kock koci,0
2025-10-15T16:44:42Z,@yogiekurniawan6151,pattynama prime audero prime paes prime oratmangoen prime ole prime verdonk prime lebih masa prime justin hubner kawan2,0
2025-10-15T16:44:17Z,@PakmamanPakmaman-i4j,tuju erick tohir patrick kluivert ganti,0
2025-10-15T16:43:59Z,@firmanrfaza2527,erick mundurrr,1
2025-10-15T16:43:52Z,@amorudz,gausah jauh2 ngomong latih mundur yah spaletti tuh abis kalah sama norway doi mundur,1
2025-10-15T16:43:01Z,@kandar56,enjoy banget nontonin episode,3
2025-10-15T16:42:12Z,@fianmaedillah864,ikut kalau fc mahhh,0
2025-10-15T16:42:03Z,@adityapratama6800,turut gw tuju bg liga mahasiswa jadi mantik mana sekarang power mahasiswa sedang tinggi media jadi naik gairah sepak bola indonesia bangun bawah jadi lebih mudah inti liga mahasiswa bagai mantik gairah cara engagement mahasiswa sekarang sedang besar besar,1
2025-10-15T16:59:37Z,@pesmobile-lh5fs,buat club bola tiap universitas masalah biaya nya lapang tempat latih pr yg sangat berat,1
2025-10-15T17:19:43Z,@adityapratama6800,pesmobile lh5fsiya aku pikir gitu tiap modal turut ku pasu tonton mahasiswa cukupoke kalau udah kembang pakai metode kompetisi antar prefektur kayak jepang meminimalisir keluar home away nya juara antar prefektur baru adu nasional,0
2025-10-15T16:41:43Z,@aria_setiawan,waduh lurus jadi kan coach justin gak tau sepak bola indonesia jadi gak sesedrhana riwayat jangan lempar supporter reaksi sesuai kondisi lapang yg lihat jadi dulu supporter gak pernah dikit dikit minta pecat yg gampang dikit dikit mecat tuh pihak federasi yg masalah dulu banyak korban sty gak pernah proses dulu instan patok tiap gagal juara aff ganti terus gitu loop tiap tahun rahasia umum main dbalik layar kait judi taruh campur tangan mafia intervensi main latih atur sogo sampe bahas masuk mata nazwa loh makanya orang orang sebut aff sarang mafia nah jaman masuk sty semua ubah gampang orang masuk ngaatur ganggu tuh penting orang orang sebut buka lah tuh anomali timnas mulai dokter abal abal main jadi malpraktek jadi banyak yg dukung sty buat ubah signifikan mulai sport sicience pola makan disiplin mindset timnas yg dar buat taktik atas lapang fundamental jadi plis lah dimengert timnas indonesia tuh bukan dar menang kalah aja kacau makanya supporter udah muak,1
2025-10-15T16:41:20Z,@CrookedYoun666,kochi,1
2025-10-15T16:41:16Z,@yogiekurniawan6151,main tua pelupessy32 thomandsandy30 kevindiks29 jordiamat33 kambuaya29,0
2025-10-15T16:40:29Z,@roccegcreation8087,bojan hondak dahh paling pas,0
2025-10-15T16:40:21Z,@fajarlukman2652,justin jemboaddd bukan cari konklusi malah cari bela tu cari jalan keluar tak botak judoll bukan cari sp salah sp bener susah emg dna judi wkwkwkwk,0
2025-10-15T16:39:33Z,@nadiefaputramaulana788,koci pecah bangsa,0
2025-10-15T16:39:30Z,@instalimbangan,bang fer undang ruang taktik biar ketemu koci,0
2025-10-15T16:39:24Z,@AbiThalib-u5j,pas ngomongin et koci panik wkwkwk cuci tangan yg bersih kuch jadi jubir,0
2025-10-15T16:39:09Z,@rieldotampubolon1585,makin luas cuci tangan awkoakwaokwao,0
2025-10-15T16:38:42Z,@rezaaditya8885,kolcar kalcer kolcar kalcer,0
2025-10-15T16:37:09Z,@justsuckit69,masalah main asia coba sebutin team mana pake pilosofi total football hasil asia,0
2025-10-15T16:36:49Z,@greatdonutello,koci mikirnya kaya instan terus padahal mulai baik liga cepat bukan masalah lama nggk nya lama makanya mulai jangan halang rakyat punya mimpi,3
2025-10-15T16:36:49Z,@azzachanel7545,inti erik tohir msih kalah sm pundit quot g jls yg cm ngoceh cari cuan tnpa mikir msrkt bnyk,0
2025-10-15T16:36:46Z,@rdbs99,gilak seru bet coo episode,2
2025-10-15T16:36:12Z,@Amen-g8y,ferry n arie yg lunak koci,16
2025-10-16T01:50:08Z,@jagmaharesi2486,pange,0
2025-10-16T03:32:15Z,@nnabcd,lebih tepat sadar,0
2025-10-15T16:35:53Z,@arissinaga2978,inggris thomas tuchel yg latih bang orang jerman,0
2025-10-15T16:35:52Z,@walkmorea,cuci tang y bersih tin justin,0
2025-10-15T16:34:36Z,@ZulvedeIsmal,total football kuno sekarang ngak total football cuma johan cruyff jadi main titik,0
2025-10-15T16:34:08Z,@muhammadafif7645,alah alah ferry ferry lu orang nya cerdas ngerti maksud kochi yg gw liat kalian cuma counter nyata kochii olah salah cari solusi cuma pundit ga adil buat kochi muak liat sepakbola lama gmna udah coba asam garam nya naiff bener ferry sama ari,0
2025-10-15T16:34:00Z,@arvangregorius4492,udah lah fer gk lu bawa afc u bagai benar seolah2 diaspora fine2 aja ngga sama sekali kompetisi kelompok umur is different cake sm senior kelompok umur lu mgkin perform minim diaspora senior forget it mau ngandelin pemaen liga joget doang sure goodluck,1
2025-10-15T18:33:28Z,@rizkyakbarmaulana1424,gw tuju sama lu bro gak jadi parameter liat pas main u19 pernah kalahin korsel stadion sawah main u19 korsel yg main epl sekarang yg u19 indo mana sekarang,0
2025-10-15T19:30:43Z,@arvangregorius4492,rizkyakbarmaulana1424 emg ud fakta utk jangka pendek diaspora emg game changer bener gk gantung lama sm diaspora lama2 bakal habis jg udah turun cm kalo bina dibenerin dr skrg hasil paling cepet baru liat tahun lg nah lama rentang tahun suka gk suka ngandelin diaspora nggu jalan paralel dua2nya program bina naturalisasi,0
2025-10-15T16:33:48Z,@ArifZaissproo,bang ferry org yg paling pantes ngecounter toweeeel,0
2025-10-15T16:33:29Z,@SusiloRegas,pikir bang fery terima,3
2025-10-15T16:33:28Z,@Daily_timnas,sumpah diskusi paling keren soal bola indonesia,4
2025-10-15T16:33:24Z,@TamhuluHulu,sty latih paling bagus dunia sangking bagus baru match pegang klub korea udah kena pecat wkwkk woy netizen sadar,1
2025-10-15T16:32:48Z,@oktorakris7518,kalau kalah hujat kalau menang sanjung biasa,0
2025-10-15T16:32:45Z,@Afixora,inti pecat dulu deh bintang laut habis pikir gimna cari coach yg bagus punya gaya yg cocok ditimnas,0
2025-10-15T16:32:43Z,@HaiseSetiawan,liga smp kayak awal futsal dulu gua pernah ikut sekolah kabupaten kota menang ketemu kabupaten kota sejawa timur dulu gk cakup nasional arang dana,0
2025-10-15T16:32:38Z,@aldoserena9589,main diaspora emang belanda budaya emang sana kan gak main belanda aja jay yg main italia verdonk prancis pelupessy belgia diks jerman apa main sana gaya belanda enggak lah apa maksain klub nya main gaya belanda gak lah main profesional kualitas nilai jalan gaya taktik latih bukti makanya main eropa contohin satu emang main timnas belanda main liga belanda semua emang virgil main belanda emang virgil maksain liverpool main total football enggak jadi alas budaya kayak alas bocil yg sama kakek2 tua,8
2025-10-15T16:32:06Z,@edysuryadi2245,kayak cape verde ga perlu bincang rumit deh lolos pildun asal pemain2 jago latih nya cocok federasi dukung hasil nya udah deh otw pildun sayang nya negeri terlalu banyak penting udah pemain2 full abroad aja rungkat,0
2025-10-15T16:32:03Z,@MWR_CHANEL,ratu tisa bos arya cuma sampah ga tau bola,0
2025-10-15T16:31:49Z,@umarmuhammad4350,tuh gua udah subs,0
2025-10-15T16:31:24Z,@tubagusreiza4945,video iklan layan masyarakat bagaimana cara cuci tangan baik benar,1
2025-10-15T16:30:27Z,@HellKitchen-x2w,tuju siap buat jadi sponsor team sd cibinong yg mau tanding,3
2025-10-15T16:30:18Z,@ozieahmadofficial8394,pernah jawab sama indra syafri kalau gak salah mau kembang filosofi filanesia,0
2025-10-15T16:30:12Z,@AkmalRizal_,liga sma masuk akal sih coba liat nbl,0
2025-10-15T16:29:35Z,@ErniNuryani-d2o,jejak,0
2025-10-15T16:29:13Z,@ookasah,cuci tangan dolo tak,0
2025-10-15T16:29:13Z,@GebolBulbul-yz9zo,justin mau belandalisasi semua,1
2025-10-15T16:27:24Z,@firmanrfaza2527,bener bangferry gausah belanda anjg,0
2025-10-15T16:27:24Z,@diamondgivenchy8147,justin nyari aman,0
2025-10-15T16:27:10Z,@bismohediyanto8184,total football sekarang gw tanya apa total football pernah juara dunia mikir,0
2025-10-15T16:27:03Z,@keycreativeagency9531,justin vs ferry liat beda beda level pola pikir rasional et minta si justin seh jadi malah gak mau intropeksi diri,0
2025-10-15T16:26:54Z,@Mielidi516,wkwkwk sibotak cuci tangan,0
2025-10-15T16:25:53Z,@edysaputra9763,lihat jalan timnas jelas sini et tanggung jawab sepenuh yg siapa yg jadi latih mau kelas pep latih city kelimpungan butuh periode tahun buat fondasi tim sama yg laku sty jadi kalo mau cari kambing hitam ketua federasi sini kalo mau maju jangan salah evaluasi pakai yg moga depan tim lebih baik viva indonesia,0
2025-10-15T16:25:09Z,@dorongdrum,aneh jug bg ferry ngebandingin u23 sm senior,0
2025-10-15T16:24:48Z,@loviluv,baru sini si koci nongol hari timnas gugur hari minggu pagi biasa langsung buat video timnas main betapa kecut yg pingin hindar netizen cinta timnas takut jadi sasar amuk gemar bola timnas,0
2025-10-15T16:38:19Z,@loviluv,memang salah satu yg tanggung jawab atas pecat sty ganti latih baru ga usah kelit lu koc semua tau omong lu lama gimana lu yg memang pingin ganti latih timnas kalah jadi china lu pingin quot probabilitas quot tingkat latih baru bukan sty sekarang apa probabilitas taek lu yg malah zonk dah lah ga usah sok an lu ngurusin timnas nonton liga aja ngga sok an ngurusin sepakbola nasional main nasional aja ga lu kenal urusin aja sepakbola luar belanda inggris arsenal apa sana jangan sepakbola negeri yg lu perhatiin sepakbola lokal aja ngga ah f k u lahh,0
2025-10-15T16:24:24Z,@EkaInayah24,gak suka dikit dikit pecat lu dukung sty pecat ganti,4
2025-10-15T16:24:16Z,@danitwa,bang fery objektif lanjuttt,0
2025-10-15T16:23:42Z,@vitovandersen2876,nitip sendal,0
2025-10-15T16:22:50Z,@asepmaman9976,teu iklas timnas gagal sama erik tohir sama si patrick lebih iklas gagal sama sty kana yg ngebangun timnas sty sama iwan bule,0
2025-10-15T16:22:45Z,@R.MuhamadFaizAmaliAuliaRachman,latih negara yg sama culture yg sama beda dgn sepakbola negara yg baik liga irak latih jg bukan irak brazil latih italy,0
2025-10-15T16:22:40Z,@firmanrfaza2527,maksain banget total football ajg omong kosong,0
2025-10-15T16:22:33Z,@Katou-sama,mantap koci,0
2025-10-15T16:21:37Z,@freddytanzil3581,jadi ajar obrol kalau sibotak mau terima terlalu bangga negara gak pernah juara piala dunia jaman jajah bilang jilat londo,0
2025-10-15T16:21:13Z,@AbiThalib-u5j,total football is total bullsh t passing2 kek ayam pala belanda kek pernah juara pildun ae total football mulu,0
2025-10-15T16:21:07Z,@gabrielphilemon6469,orang orang beneran peduli sama sepak bola indonesia salut respect,4
2025-10-15T16:20:59Z,@arvangregorius4492,tp iya sih cuma konoha timnas gagal pandit ikut disalahin wkwkwkwk luar negeri kayak ngga gini2 wkwkwkwkw emg kocak negara iq,0
2025-10-15T16:20:35Z,@billytanuwijaya8,ayo bikin kompetisi antar sd amp smp semangat,1
2025-10-15T16:20:03Z,@parhanadam4937,nah bikin milestone kayak hanif keboost subs,0
2025-10-15T16:19:57Z,@juwanndempo,kochi cuci tangan tuh takut sama kit quot suporter indonesia,0
2025-10-15T16:19:20Z,@Yogixsiput,jangan bahas u23 lah kelompok umur negar negara kuaat sepakbola asia hampir semua turun main muda kuat main eropa tim tim eropa gak ngasih izin main piala asia u23 loh model korea jepang iraq lai jadi turut gw jangan terlalu jumawa ngomong king indo king indo mulu biar lebih mijak bumi aja,0
2025-10-15T16:19:11Z,@refreshingtimelinee,yg gasuka sty main bukan pssi,0
2025-10-15T16:18:41Z,@bagusbagus9840,habis makan cuci tangan yg koci botak total football gagal total,0
2025-10-15T16:18:01Z,@yongkimulyadi8361,sebenernya koci objektif jelek2 bagus2 gak suka masyarakat indo kalo kritik bilang benci,0
2025-10-15T16:17:42Z,@DarmaKhayra-c9r,kata mau stop omongin timnas mana makan fuck lah,0
2025-10-15T16:17:30Z,@nusaantara6077,hadap ferry ama mamat koci cuman aki2 belanda asbun doang,0
2025-10-15T16:17:22Z,@abyanaaric5503,si botak ne mutar2 ngeles mulu counter fery ujung2nya jawab quot makanya gue bilang ganti quot asli tetap ngeyel kalau sty lebih baik pk si paling coach latih futsal paking tahu sepakbola,0
