Date,UserName,Comment,Like
2025-10-15T15:31:27Z,@kn19xd22,gw harap liga benar benar benah utama liga buat kelompok umur minimal adain turnamen liga kelompok umur tiap daerah indonesia barat tengah timur biar lebih gampang atur,1
2025-10-15T15:31:20Z,@prabowo9431,latih belanda aja kagak laku eropa paling2 laku cumn liga domestik tipikal nya udah kuno kagak cocok buat sepakbola sekarang gak beda jauh sama pelatih2 inggris sama2 bebal yg ngusulin pake latih belanda tolol oke kalo mau pake latih eropa pilih tuh spanyol jerman,0
2025-10-15T15:30:57Z,@ikhsan2482,wkwwkkw jadi om simon scouting lapang mana hahahaha,0
2025-10-15T16:06:59Z,@Dcm786hk,gerbong emang gaji buta sama turis aja semua sebenernya fakta dikit buka,0
2025-10-15T15:30:18Z,@mr.flakes27,balik sty lah,0
2025-10-15T15:29:50Z,@KAtoztheking,inggris latih jerman woiiii,0
2025-10-15T15:29:39Z,@masaan6896,feri pinter tp g paham realita lapang ngomong struktur bagus kaya anis tp lapang bubar semua sukit menganalisa realita masyarakat bau cuan,0
2025-10-15T15:29:13Z,@irfanoeriph,sekarang sepakbola mjadi pecah belah disgala lini klo dulu sepak bola mnjadi satu bangsa kini hilang sdh sama hnya krn congkak dr ketua pssi langkah salah besar skrg dgrkan suara quot rakyat yg tlh kecewa semua bahagia kmbali,1
2025-10-15T15:28:58Z,@riviann,gas kongres pssi masa depan,0
2025-10-15T15:28:46Z,@geofani2439,tuju sama koci,0
2025-10-15T15:28:40Z,@Zenitsuuu_,gas liga sma,0
2025-10-15T15:28:26Z,@BluePrint5150,luis mila sty punya konsep yg jelas banyangin klo luis mila pecat udh tinggal nikmat hasil sty udh nyambung main u17 sampe timnas senior pecat,2
2025-10-16T03:18:21Z,@rizmeg3190,luis milla kagak pecat bang kagak gaji beliau sebenernya mau panjang sama oak eddy rahmayadi cuma exco kongkalikong biar pak edi kagak punya power,0
2025-10-15T15:28:04Z,@ILO3223,total football butuh skill cepat tinggi apa main,0
2025-10-15T15:27:58Z,@KuyingKuying-b6v,bang irwandii lebihh cocok jadi analis bola ketimbang ngurisin politik mantap bang,1
2025-10-15T15:27:53Z,@ElijahChesterton-i1w,pantes kwn nyaman main ,0
2025-10-15T15:27:42Z,@IsaacBoolman-r3v,ronde ikut coba  bang,0
2025-10-15T15:27:40Z,@onAidenDods-b3r,bangun tidur langsung buka ,0
2025-10-15T15:27:24Z,@untungdharmanto9806,turut ku emang indonesia pantas masuk piala dunia mau latih siapa tetep gagal piala dunia kalau piala dunia mimpi siang bolong kalau lolos piala dunia,0
2025-10-15T15:27:19Z,@agungsugiharto9409,justinus quot halu quot ngomongin filosofi utk timnas garuda main diaspora main indonesia bukan timnas the oranje,0
2025-10-15T15:27:17Z,@ZainalAbidin-kx3sx,bner nya kata towel kualitas main bagus banget sampe nyiptain peluang aja sulit finishing susah,0
2025-10-15T15:27:10Z,@raendytiawarman,apa jawab dr coach justin mutar muter udh akuin aja klo sty jauh lebih baik klo mau ngancurin mimpi gausah ribet ngomongnya,0
2025-10-15T15:27:00Z,@HusenMustaqim,sty main gantung main kondisi lawan main tik taka main prakmatis,0
2025-10-15T15:26:57Z,@VincentRompis-fz6om,kurang dana buat kembang main muda bina coba kalau sedia perintah triliun tiap tahun ga perlu ramai ramai laku mau revolusi gmn susah ga dana yg dekat ideal,0
2025-10-15T15:28:08Z,@VincentRompis-fz6om,pssi tambah perintah aja cuma ratus miliar kayak nya buat sekadar bikin kompetisi usia muda seluruh indonesia aja pas pas bahkan ga cukup dana timnas kalau mau buat lebih bina butuh beberapa triliun per tahun butuh berani politik jamin dana,0
2025-10-15T15:26:47Z,@amiaya8423,lebih tuju koci kunci bina banyak main indonesia level u15 atas pasing aja lum beres bukti banyak video coach nova misuh misuh klo yg feri lebih jangka pendek biar rame aja trus untung g sponsor hilang sendiri ferry irwandi lebih bisnis sepakbola sedang koci bina sepakbola indonesia cara lanjut benar konsep koci ferry gabung baik segi komersil bina jalan baik insyaallah jadi blueprint arah yg lebih baik yg penting konsisten lanjut,2
2025-10-15T15:44:50Z,@BlackRanger666,iya nyata kaya basket aja dbl level sma udah jalan beberapa tahun antusiasme bagus nah dbl biasa beberapa main unggul kirim training luar negeri mungkin sepakbola nyontoh,2
2025-10-15T16:14:49Z,@amiaya8423,blackranger666klo lihat antusisme bagus g masalah sponsor konsep turnamen plus entertainment bakal undang antusisme yg sama koci bina karna klo level sma baru cari bibit basic banyak keteter misal passinglah fisrt touch lah reading the game yg kurang banyak kurang main jadi alangkah lebih baik banyak kompetisi usia dini yg mana usia dini umur bawah tahun,2
2025-10-15T17:37:08Z,@BlackRanger666,amiaya8423 saling iring aja koci level dini ksd nya terus ferry pihak buat level yg tengah salah kalo ngeliat peluang bisnis sini salah satu tuju tetep kembang sepak bola indonesia,1
2025-10-15T15:26:38Z,@Tadofals,botak kompor leduk,0
2025-10-15T15:26:37Z,@rofihendra3731,hmmm kan budaya permisif yaa filosofi bola jadi biar lawan menang,0
2025-10-15T15:26:10Z,@LaizaummamiRaka,hajime moriyasu latih jepang bagus tang jepang percaya diri lawan timnas german spanyol uruguay akhir lawan brazil,0
2025-10-15T15:25:51Z,@Ghassan_Alyasa,total long ball aja filosofi nya,0
2025-10-15T15:25:40Z,@mochamadazzam,yg gendut motong mulu dah,0
2025-10-15T15:25:33Z,@BrianYou-q7v,bahasa belanda cuci tangan apa,0
2025-10-15T15:25:31Z,@AdjieKusuma-y7x,kalo ambil latih asia musuh asia kok lebih bagus kok belanda,0
2025-10-15T15:25:21Z,@benyradik5949,era sty cukup lah kalau sty memang bagus korea gak bakal pecat club korea kok barusan buka era yg baru gaes,0
2025-10-15T15:25:08Z,@tebuncolTV,kalian ngomongin apa sih,0
2025-10-15T15:25:01Z,@bungriski7727,kalo aja liga anak anak u10 bawah askot main tiap minggu lama musim kompetisi kemudian liga askot tanding juara tim selection nya level provinsi bawah asprov kemudian lanjut juara tim selectionnya main tingkat nasional tahun depan anak2 naik level u11 main liga sama cuma beda level usia terus anak anak masuk usia mungkin situ lebih mudah main jadi matang kompetisi rapih satu pintu bawah federasi,1
2025-10-15T15:24:58Z,@abdullatif8212,nitip moga wujud,1
2025-10-15T15:24:25Z,@riandiponegoro7955,menit timnas inggris latih orang jerman si thomas tuchel,0
2025-10-15T15:24:18Z,@nafisah4179,klu pecat pssi hrus bayar kompensasi 40m hrusnya pk sadar diri mundur,0
2025-10-15T15:24:17Z,@KijidSatu,justin nape sih pala lu batu banget minta maaf engga lo masuk arus huru hara kalau ga mau minta maaf rasa malu dikit deh,0
2025-10-15T15:23:57Z,@DedeRahmat-ym1tm,filosopi emang benar filosopi grasak grusuk datang main diaspora banyak banyak nya yg kata level eropa ganti latih banyak timbang lupa bina main muda baik liga karna filosopi yg butuh jangka panjang ga cocok,0
2025-10-15T15:23:39Z,@NasriSintesa,bubar pssi gak usah sepak bola indonesia percuma olah raga sepak bola klu tujuanx bukan utk maju sepak bola indonesia yg cuman gaduh,0
2025-10-15T15:23:10Z,@khaerulel-baha1432,,0
2025-10-15T15:22:58Z,@syauqialillah9945,taubat nasuha,0
2025-10-15T15:22:56Z,@galihnugros,titip sandal,0
2025-10-15T15:22:43Z,@edwinstevie8000,keren saling adu argumen gak dogoblok2in,0
2025-10-15T15:22:38Z,@yusaalf606,menit menit akhir bahas nya keren sih,3
2025-10-15T19:22:33Z,@YokiPrasetya,poll keren moga wujud,2
2025-10-15T15:22:12Z,@cuttinghard,jadi ketua pssi laku wajib sepakbola tahun sd wajib sepak bola tahun smp wajib militer datengin tom bayer yakin tuh temu bakat potensi anak bakat adakan beasiswa minimal minimal wajib lapang sepak bola latih bola minimal lisensi tiap sd smp negri,0
2025-10-15T15:22:12Z,@BangJhon-q5x,bobi sini,0
2025-10-15T15:21:56Z,@R4J4-u3g,lanjut gue subscribe deh,1
2025-10-15T15:21:52Z,@aryoseptian4269,mencla kencle mulu botak kacoo aja undang sana sini,0
2025-10-15T15:21:40Z,@cendetfootball,gw lebih tuju timnas pegang mantan latih timnas vietnam quot park hang seo quot yg sangat susah diklahkan era shin thae yong,0
2025-10-15T15:21:38Z,@fikrimust3192,bagus nih bukan cuma obrol ngalor ngidul mikirin solusi lebih tanggung jawab banding pssi amp kluivert,1
2025-10-15T15:21:26Z,@agunksaputra3499,si paling belanda ubah bicara,0
2025-10-15T15:21:15Z,@KrayScent,lu sadar botax ikut lu bnyak jadi omong lu punya pengaruh besar tp,0
2025-10-15T15:21:11Z,@pemulatamiya3905,akhir sini hp lihat tolol tempat lawan bicara hah heh hoh doang,0
2025-10-15T15:21:05Z,@fajarhidayat1394,thomas thucel pindah warga negara nih sekarang blooook,0
2025-10-15T15:20:55Z,@gent_world,sisa ruang ikhlas,0
2025-10-15T15:20:52Z,@herawan4760,ngaco bodoh justin ga apple to apple kalau indonesia banding dgn inggris jerman italia sepanyol negara yg pernah jadi juara minimal masuk empat final sdngkan blm pernah masuk pildun samain dgn negara kamerun thn masuk empat final latih valery rusia ga bahasa inggris ga tau budaya kamerun latih arab saudi banyak negara negara kecil sepakbola banyak latih bukan negara,0
2025-10-15T15:20:46Z,@davyjones8680,justin cepet banget rubah posisi kemarin bain latih belanda mumpung blm rujak akhir dukung pecat latih koplak,0
2025-10-15T15:20:29Z,@wiskiedesignlab8293,isuk dele wengi tempe,0
2025-10-15T15:20:26Z,@musikalisasi1439,justin lupa dulu ngomong apa pas erik tohir pecat sty,0
2025-10-15T15:20:21Z,@Tripwithadi,gk suka pecat2 knp lu dukung pecat sty botak apa dasar nya gaya2an lu main bek sok sok belanda apa kalau lu tau sty china sabotase si mees bangke lu double standard botak botak lu minta maaf dulu lah soal sty,0
2025-10-15T15:19:57Z,@agilsetiawan3133,tonton bapak2 tua koci jawab tanya ngeyel trus omong kosong mbah koci,0
2025-10-15T15:19:35Z,@alifandika9964,mending spanyol jerman aja lah jelas bina bawah belanda stuck,0
2025-10-15T15:19:07Z,@ahmadzamroni6412,pinter ngomong muter trus ngomongnya nyampe bersih ego tinggi liga indo g mau politik trus suruh tolol jamaah,1
2025-10-15T15:20:41Z,@alifandika9964,suruh jadi member youtubenya biar paham pikir,0
2025-10-15T15:18:55Z,@ghaniakbar9269,cuci tangan pakai sabun gaess,0
2025-10-15T15:18:31Z,@Scuderiaz,turnamen e football kayak lebih ramai deh main,0
2025-10-15T15:18:11Z,@NarasiKehidupan,kecut pundit cuma bacot doang sana loh geruduk pssi apa si erick thohir berani gak ngomong langsung depan muka baru gua acungin jempol,0
2025-10-15T15:18:02Z,@InfoDuluGuys,bicara dengar pssi laku koreksi,1
2025-10-15T15:18:01Z,@vncent853,maniak banget dah sama total football heran wkwkwk jam justin jilat et,0
2025-10-15T15:17:51Z,@aldianovskyshaka7931,cukup dengar bela justin aja apa omong,0
2025-10-15T15:17:33Z,@alviananta7971,sedang jajah belanda,0
2025-10-15T15:17:31Z,@kakapradita5163,fer coach inti nya main tengah maen bola cuma intelegensi nya kurang jdi cari main yg iq tinggi coach contoh marselino bagus cuma matang fer analogi nya gin kyk sambung ayam j menang ayam yg punya jalu yg pintar ambil momentnya,0
2025-10-15T15:16:40Z,@KimKanyoon-g4v,total football wkwkwkwkwkw,1
2025-10-15T15:16:14Z,@StudioRD99,covidd udah kelar berapa tahun lalu loh kok cuci tangan mulu wkwkwk,0
2025-10-15T15:15:15Z,@you.knows_,bener nih mau bikin kongres pssi masa depan gue dukung nih bang ari bang ferry koci,1
2025-10-15T15:14:54Z,@anythingisokay1933,w subscribe kampret,0
2025-10-15T15:14:37Z,@rahadianm2957,probabilitas kau ni resah coach hahahahahaa,0
2025-10-15T15:14:17Z,@solahasian,tips enak nonton koci ikut ngebanterin beliau biar lebih hidup keluar,4
2025-10-15T15:14:03Z,@nurulazland,info join buat partisipasi rencana program banh ferry mau gabung,0
2025-10-15T15:13:59Z,@TuruNgising,edannn tiga tiga enak semua dengar sama sama faham apa bicara edannn pundit nomor dunia,1
2025-10-15T15:13:53Z,@jokeinsidejoke9414,dana mbg lebih bagus klu alih bina bangun insfratruktur main bol umur tahun kali,2
2025-10-15T22:18:20Z,@annakareninna4172,nah,0
2025-10-15T15:13:17Z,@risqiaji3622,pk out sih wajib,1
2025-10-15T15:13:03Z,@hariantoharianto5561,ambil latih sprti ambil kucing dlm karung aja bgtu kalah,0
2025-10-15T15:12:45Z,@bryansihotang1496,meski sedih nyata pssi evaluasi moga jadi ajar baik liga sistem usia dini ssb moga jadi nyata,1
2025-10-15T15:12:40Z,@alifandika9964,gak semua belanda coach rangin fetish belanda,0
2025-10-15T15:12:34Z,@fajaryk4205,gw tuju patrick pecat tp gak tuju sty balik ngapain cukk 5thn piala gk dapet diaspora gak lolos grub aff,0
2025-10-15T15:12:33Z,@francogan4021,beri aku kochi niscaya cabut meru akar beri aku ferry arie niscaya guncang dunia oktober sumpah pemuda siap kongress cinta sepakbola seluruh indonesia,0
2025-10-15T15:12:25Z,@stdwic4736,mampus kau koci orang temen lu pinter mancing,1
2025-10-15T15:12:18Z,@MadremFernandes,kalo gagal latih yg bangun fondasi awal terima,1
2025-10-15T15:11:53Z,@AvJoule,kochi sempet bilang et hebat nutupin utang pssi m jadi surplus m sori kochi monyet kalau jadi menteri bumn bakal bikin surplus duit pssi fakta sponsor bank mandiri aja pssi timnas dapet m udah nutup tuh utang sisi pssi dapet miliar lebih apbn jadi banding ga apple to apple emang kapan menteri bumn jadi ketua pssi iwan bule bukan edi rahmayadi bukan nurdin khalid bukan jadi argumen et bikin surplus biasa banget ga hebat hebat tuh erick orang mayoritas pake duit negara kok an miliar pake duit rakyat via apbn pajak utang miliar pake duit negara via bumn bank mandiri sisa baru tuh mungkin sponsor swasta gausah monyet kepinteran sendal jepit aja kalau jadi menteri bumn bakal bikin surplus duit pssi menteri bumn menpora jadi ketua pssi bukan hebat kochi justru lebih deket abuse of power argumen erick deket sama fifa ampas semua kok pildun u udah lobi batal kok protes fifa ga didenger kok sama fifa ampas barang terlalu megalomania tks,0
2025-10-15T15:29:23Z,@Dcm786hk,bro kayak quot lucut quot nih gelontor duit segabrek malah bikin malu quot pusat quot kek kesel banget sama latih rekrut sama bisik pundit nya bikin sesat cuci tangan,0
2025-10-15T15:11:40Z,@renaldypalgunady5710,tiap klub liga super pnya klub didik u20 u17 tiap tanding klub liga u20 u17 bwa tanding mmg bnyk makan biaya subsidi pssi khusus u20 u17,0
2025-10-15T15:11:19Z,@duniaprint3193,baru bener2 percaya goda prestasi sepakbola indonesia bener2 skrg,4
2025-10-15T15:10:57Z,@sukronongky5111,hati koci semua cara pandang lu ber udah gua fikirkan bas tahun lalu karyawan baru langsung komentar sistem bahkan berfikir cara maju usaha lihat realita usaha memang racik bukan maju,0
2025-10-15T15:10:49Z,@ahzafannayakaqutbi4875,nitip sendal,0
2025-10-15T15:09:18Z,@jfufndx,justin bakal ngedukung sesuai apa suka kayak barca belanda kalo ga suka bakal benci umur hidup,0
2025-10-15T15:08:58Z,@Firdaus077,inti pssi bebenah seluruh segala utama sikat orang2 yg punya penting pribadi yg untung pribadi kelompok,1
2025-10-15T15:08:47Z,@wawan502,ganti ajah pk tp gga usah sty cari yg lbh kualitas,0
2025-10-15T15:08:06Z,@Aku123-rd2lj,kosong stadion tanding timnas cuma manfaatin suporter jual tiket ludes cuan bagi2,0
2025-10-15T15:07:45Z,@bagus9990,inggris sekarang sama thomas tuchel cochin,0
2025-10-15T15:06:42Z,@aimnyagakerasyaa,patrick kluivert yg out jajar nya ga usah alex pastoor jdi latih nya,0
2025-10-15T15:06:36Z,@ghaneshamaulana,kali kata koci netizen dikit dikit pecat salah total dasar kata apa kapan netizen bilang sblm trik krna fakta sty thn loh ngelatihnya jangan kambing hitam netizen,3
2025-10-15T15:06:33Z,@aldydome9470,mungkin kalo pastor den landzat libat karna satu satu inti pk dkk out bukti kalau latih cocok buat timnas kalo ga korea japan jangan harap bakal masuk pildun bahkan afc cup aja babak bur kalau harap latih belanda filosofi main bentuk masa sty ngapain ganti filosofi bentuk kan kalau kurang tinggal poles runtuh pondasinya omong kosong mikirin jangka panjang sedang jangka pendek buat lolosin pildun aja babak bur,0
2025-10-15T15:06:27Z,@irulfamilyofficial,nyimak,0
2025-10-15T15:06:12Z,@muharief4604,erick thohir mesti mundur pssi,0
2025-10-15T15:06:07Z,@ardhismile2143,coach punya opini begini turut indonesia memang cocok main total football meski diaspora besar main sepakbola eropa tetap milik darah indonesia coach bukti diaspora banyak main defender coach jangan jangan sty benar coach meski banyak main diaspora lebih cocok main pragmatis maaf salah,0
2025-10-15T15:06:05Z,@AlisyaNahzika-s4p2g,udah kalian coba aja maju jadi tum pssi indonesia banyak komentator bagus kurang sosok eksekutor bagus yg mau benar quot tindak,0
2025-10-15T15:05:26Z,@Klateks-mi7bf,baru kali podcasr koci kena tekan wkwkwk,0
2025-10-15T18:54:08Z,@agamkupie985,gak sama pangeran lebih parah,0
2025-10-16T02:57:25Z,@Klateks-mi7bf,agamkupie985gk parah sini,0
2025-10-15T15:05:19Z,@Masadefauzi,sty out sty out sty out kompor nya org tua rese wel wel sama tin tin sty out trs patrick datang trs hati rakyat hancur lebur diem mlempem nama orang tua rese banyak alesan,0
2025-10-15T15:05:16Z,@yeniarnissa7426,woi jing si paling belanda loe maksain total football tolol aja belanda aja total football apa pernah juara bahkan belanda pernah absen piala dunia memang main mayoritas turun belanda tolol aja kalo paksa total football gak masalah mau parkir bus mau parkir pesawat asal tingkat prestasi kalau paksa filosofi sama justinus laksana iya jajah sah,0
2025-10-15T15:05:16Z,@moh-y9t,gak jadi beri sempat nyampe piala asia nih koch wkw,0
2025-10-15T15:05:15Z,@DedikSudianto,koci pemikiranya renda total fotbal gk penting,0
2025-10-15T15:05:14Z,@audiofreecopyrightdownload,males gua nontonnya,0
2025-10-15T15:04:22Z,@amwaranwar6759,erick tohir masuk angin patrick gak usah balik indonesia melayih timnas gak layak,0
2025-10-15T15:04:19Z,@vleolive,filosopi indonesia gotong royong,0
2025-10-15T15:04:09Z,@rizkyyuliandraahmad,,0
2025-10-15T15:03:58Z,@excelchandratirta4546,kalo pilih latih karna kultur ga tuju karna faktnya main campur belanda ber karier luar belanda,0
2025-10-15T15:03:35Z,@helmfutsal,hir thohir interview pas natal wkek,0
2025-10-15T15:03:33Z,@sembilandosa,feri sama ari suruh lihat dulu liga indonesia justin lebih rasional,0
2025-10-15T15:03:22Z,@Hazil-n7l,ketua umum ganti,0
2025-10-15T15:03:11Z,@agungsugiharto9409,suara justinus terlalu berisik,0
2025-10-15T15:02:44Z,@solomonpanjaitan5891,wah podcast bola yg paling kelas mnrt aku,1
2025-10-15T15:02:21Z,@AndreEducation,,0
2025-10-15T15:02:16Z,@WayeOk,tohir uang rakyat jadi korban tega sekali rakyat kau korban suara rakyat abaykan malah dengerin musuh rakyat towel apa gak nangtangin rakyat nama,0
2025-10-15T15:01:52Z,@cendeki4,bentar ambil cemilan dulu,0
2025-10-15T15:01:49Z,@FerySandrya11,menit krusial vs china vs arab yg aneh sih kalo logika kan,0
2025-10-15T15:01:09Z,@primadani07,gua baris tuju build sistem mulai kampus gas mulai bang,10
2025-10-15T15:09:59Z,@HaiseSetiawan,smp sih kayak futsal,3
2025-10-15T22:04:34Z,@T4PLAYicikiwir,haisesetiawanikutin plan jepang banget buat nama ketua pssi kurang harum,0
2025-10-16T01:07:46Z,@putriandini9799,maksud ferry bukan build sistem tpi gairah sepakbola buat yg punya skill basic tpi ga punya jalan pro build sistem tetep bawah,0
2025-10-16T03:52:41Z,@wandycam5709,buat bina tetep dri yg kecil dlu situ kayak ngak tau aja yg ngampus rata2 udh okok susah masalah gairah build dri universitas gw tuju,0
2025-10-15T15:00:08Z,@SantoBonek,jual lawan cina jual lgi lawan arab,0
2025-10-15T15:00:00Z,@aldino7207,minimal ganti luis milla guus hiddink balikin sty,1
2025-10-15T14:59:59Z,@ripanrdarmawan250,rasa main condong kick n rush,4
2025-10-15T15:48:22Z,@VincentRompis-fz6om,condong tarkam nya,0
2025-10-15T15:54:29Z,@ripanrdarmawan250,vincentrompis fz6omnah lah tarkam kan sistem game play nya mirip sama tinggal benah cara nya yg bener,1
2025-10-15T14:59:48Z,@fajarhidayat1394,botak kocak,0
2025-10-15T14:58:54Z,@Rollcling,jilat trus tu erik tak botak hahahaha,0
2025-10-15T14:58:46Z,@SuaraSicadel,dear koci sadar suara punya power bukti dl kasus jersey dulu ktika minta saran et gnti latih hrusnya kamu lbh bijak gnti latih tp jgn tengah jln biar sty slsein full kualifikasi nya kan bs ngmong gtu perkara dnger tdk hak pssi dgn statement quot mu bbrpa podcast yg olah quot giring opini bhw sty gk punya mampu lolos indonesia pildun suka gk suka mulut jg punya andil atas bencana jd please stop lindung dgn kata quot gue netizen biasa loe bukan netizen biasa loe pundit yg punya pengaruh stdknya kurang arogansi mu mnta maaf scr gentle publik sepakbola indonesia,26
2025-10-15T16:01:19Z,@normansimorangkir13,tuju dgn,3
2025-10-15T17:22:10Z,@joshuabutar-butar9504,objektif kan hak koci mau ngomong latih tahan cabut bimbang balik utama ambil bijak pssi nilai sendiri dengar orang,1
2025-10-15T18:00:27Z,@beng2046,nyata emng ga punya real power cuma bicara apa turut bener thats it cuma kalian aja yg nganggapnya gitu xd,1
2025-10-15T18:03:59Z,@adityagilangswr1217,satu kochi cuma kasih saran sty udah aneh aneh main inti lawan cina lalu ngide nyadangin sty waras tiga salahin pssi ketua nya bukan orang yg gk punya power macam kochi udah paham gk ente lul bahlul,1
2025-10-15T18:19:49Z,@chrollolucilfeer13,lah kan opini lu siapa nyuruh2 buat ngikutin elu pertahanin sty apa lu minta buat wajib subscribe wajib sawer aja kaga sejak kapan koci ken jadi representasi mainstream fans2 bola indo orang tiap minggu liga eropa aja semua fans indo hantam mau tim inggris itali spanyol jadi gausah lu fomo2 maksain opini2 lu ttg sty koci,0
2025-10-15T14:58:44Z,@simpleman3192,argumen lu lemah gak masuk akal koc,0
2025-10-15T14:58:37Z,,emg boomer tak tahu malu,0
2025-10-15T14:58:32Z,@ahmadmuza-d2g,cari aman banget sih botak satu kalaupun indonesia gagal mending gagal tang sty gak bakal kecewa botak so tau,0
2025-10-15T14:58:05Z,@DedikSudianto,manchester united klo latih orang belanda aja hancur aplagi indonesia,0
2025-10-15T14:58:04Z,@amakuchii,yaelah koci ngebela bgt org belanda,0
2025-10-15T14:57:55Z,@ShoutCarpet,foto lorong anj,0
2025-10-15T14:57:54Z,@Rndyramadhan,potong kuping gua si tohir cuma citra omong kosong mau baik sepak bola indo naon sen,0
2025-10-15T14:57:54Z,@josephputra4782,aku ga pernah lupa si pentol korek pernah ikut sudut latih sekarang mulai cuci tangan nih,0
2025-10-15T14:57:14Z,@AhmadEfendi-z8k,tuju sih sama koci kali btul cohc,2
2025-10-15T14:56:59Z,@nrandyto6198,ayo fair bro si botak memang mulai kritik sty hasil kecewa match lawan china lawan china sibotak bela mati an sty serang si handuk bahkan yg usul bikin patung buat sty dukung sty jaman tum msh iwan bule,2
2025-10-15T19:27:10Z,@rizki_550,banyak orang makan media koci kalo ngomongin argumen opini selalu blak2an apa pikir jadi makan empuk buat media2 suka framing asli mah koci selalu dukung semua cuma dukung suka doang kayak towel,1
2025-10-15T14:56:55Z,@ilhamfarabi-k7q,bung fery ose top,0
2025-10-15T14:56:53Z,@thedonatsdimas,tombol dislike mana,0
2025-10-15T14:55:59Z,@Rudi-rk7yf,tuju jangan lupa peringkat d baik biar main main luar,0
2025-10-15T14:55:46Z,@fengshui88hoki,bayangin tiap kota provinsi milik akademi fasilitas perintah bina sejak dini minimal smp sma sabtu minggu latih bareng kuatin fisik kuatin dasar dasar main sepak bola passing terima bola shooting teknik main jumlah duduk hampir juta orang masa sih gak bibit baik negeri,0
2025-10-15T14:55:42Z,@danielalexander7363,coach nova aja gak coba buat thn depan,0
2025-10-15T14:55:22Z,@citraingriddc,aduhh seru banget nitip sendal,0
2025-10-15T14:55:13Z,@duapuluhsebelas,pange x ferry irwandi aku jadi counter koci,0
2025-10-15T14:54:55Z,@suwendilelaki4366,jadi lu rakyat jelata apa influencer inih,0
2025-10-15T14:54:52Z,@Rohmandafc,tohir jgn cuci tangan,0
2025-10-15T14:54:50Z,@doditembem,pilih cuma jurgen klop frank rikard gus hidink fabio capelo selalu tempat buat sty,0
2025-10-15T14:54:22Z,@RahmatIswanto-u6n,trik udah kena siram minyak saudi,0
2025-10-15T14:54:00Z,@Clippersukses,halah justin kentut,0
2025-10-15T14:53:58Z,@MahyuAspantMusic,kata kemaren sty out cuci tangan,0
2025-10-15T14:53:21Z,@lorentztoto6433,latih inggris jerman thomas tuchel lolos inggris piala dunia,0
2025-10-15T14:53:12Z,@robiansyahisha5427,si botak klo ngomong selalu mau menang gx mau kalah rasa argumen selalu bnr,0
2025-10-15T14:52:58Z,@irwan_mj_rdr,bang jangan sama u23 dgn timnas senior lawan timnas u23 timnas jauh bawa timnas senior lawan uji sungguh lihat tim negara lawan ialah tnas senior dgn hormat bangga sty mampuh lambung timnas u23 posisi semifinal konteks bahas timnas senior soal diaspora timnas senior diaspora yg dominasi segala aspek main liga super memang laku main timnas senior yg diaspora dominasi mampuh imbang pemain2 lavel asia sembari tunggu pemain2 yg kembang liga satu program kembang usia dini jadi wajar latih calcernya ambil belanda latih yg punya rekam jejak bagus latih timnas workcup,0
2025-10-15T14:52:58Z,@sigitpramono9529,brazil latih mnaa coach,0
2025-10-15T14:52:40Z,@AbdulcekingCeking,bacottt luhhh jastien g neng pecat2 tp sty kau freming ahirnya pecat,0
2025-10-15T14:52:37Z,@GaungAgung,justin justin loe ngomong buat penting loe sendiri,0
2025-10-15T14:52:34Z,@moh-y9t,mundur bukan budaya indonesia hidup et hidup pk,0
